[
 {
  "run_id": "floor-2026-09-16",
  "generated_at": "2026-09-16T17:20:47Z",
  "added_gpus": [],
  "removed_gpus": [],
  "price_changes": [],
  "benchmark_suite_changed": false,
  "unresolved_count": 0,
  "notes": []
 },
 {
  "run_id": "scrape-2026-09-16",
  "generated_at": "2026-09-16T15:56:09Z",
  "added_gpus": [
   "amd-rx-6650-xt",
   "nvidia-rtx-3050",
   "nvidia-rtx-5050"
  ],
  "removed_gpus": [],
  "price_changes": [],
  "benchmark_suite_changed": true,
  "unresolved_count": 0,
  "notes": [
   "Tom's Hardware: 288 cells parsed, suite 2026-09-16 (94% of overlapping cards moved > 3% vs 2026-03)"
  ]
 },
 {
  "run_id": "seed-parity",
  "generated_at": "2026-09-16T15:43:43Z",
  "added_gpus": [],
  "removed_gpus": [],
  "price_changes": [],
  "benchmark_suite_changed": false,
  "unresolved_count": 0,
  "notes": []
 }
]
